{
  "schema_version": "3.2.0",
  "resolution_id": "resolution_2026-04-28_78ac1000",
  "approval_id": "approval_2026-04-28_f9821000",
  "request_id": "req_2026-04-28_6a2d8800",
  "proposal_id": "prop_2026-04-28_b3f1a2c4",
  "call_id": "call_2026-04-28_7e19c5ad",
  "action_hash": "sha256:2991d5f888b4369ae368a0e1effa0d4c9e74fe4ddf8c607ab96849aba0b28691",
  "approval_record_hash": "sha256:39bc52af43607cecff301b8ae235f7435ee7e74c669f1d43622c9437f43ec75a",
  "decision": "approved",
  "terminal": true,
  "disposition": "execute_once",
  "retry_policy": "delivery_only",
  "emitted_at": "2026-04-28T09:14:32Z",
  "delivery": {
    "target_hash": "sha256:dddddddddddddddddddddddddddddddddddddddddddddddddddddddddddddddd",
    "attempt": 1,
    "status": "acknowledged",
    "last_attempt_at": "2026-04-28T09:14:32Z",
    "acknowledged_at": "2026-04-28T09:14:32Z"
  }
}
